{
  "format_name": "ncls.training-config",
  "format_version": 2,
  "method_key": "nvidia-neural-appearance",
  "run_class": "smoke",
  "correspondence_id": "nvidia-rta2024-functional@1",
  "recipe_id": "nvidia-rta2024-layer-stack-smoke-2step@1",
  "source_adaptation_id": "layer-stack-uniform-1x1@1",
  "batch_source": {
    "kind": "live",
    "options": {
      "material_programs": ["configs/materials/layer-stack-live-smoke.json"],
      "light_count": 1,
      "samples_per_replica": 2,
      "max_depth": 8
    }
  },
  "model_context": {
    "native_feature_count": 217,
    "latent_width": 1,
    "latent_height": 1,
    "latent_mip_count": 1
  },
  "lifecycle": {"total_steps": 2, "materialization_step": 1},
  "routes": [
    {
      "name": "evaluator",
      "batch_size": 1,
      "direction_count": 1,
      "query_role": 0,
      "seed_offset": 0,
      "options": {
        "direction_proposal": "uniform-half-difference@1",
        "target_estimator": "reference"
      }
    },
    {
      "name": "sampler",
      "batch_size": 1,
      "direction_count": 1,
      "query_role": 1,
      "seed_offset": 1,
      "options": {
        "direction_proposal": "uniform-hemisphere-conditioning@1",
        "target_estimator": "learned-sampler"
      }
    }
  ],
  "seed": 20260827,
  "device": "cuda:0",
  "optimizer": {
    "kind": "adam",
    "betas": [0.9, 0.999],
    "epsilon": 1e-7,
    "weight_decay": 0.0
  },
  "schedule": {"kind": "cosine", "start": 0.001, "end": 0.0001, "total_steps": 2},
  "mollification": {"steps": 1, "start_degrees": 10.0, "samples": 1},
  "filtering": {
    "latent_fetch": "discrete-mip-bilinear-wrap@1",
    "spatial_filter": "uniform-1x1@1"
  },
  "loss": {
    "evaluator": "log1p-l1@1",
    "sampler": "learned-sampler-forward-kl-score@1"
  },
  "validation": {"interval": 2, "batches": 1},
  "checkpoint_selection": "tail_guard"
}
